{
  "bundle_version": "2.0.0",
  "detailed_receipts": [
    {
      "assurance_stage": "verified",
      "checks": [
        "task-scoped authentication resolved from governed references",
        "read and write projections converged through authoritative readback",
        "ambiguous Sapio response converged by stable request identity",
        "version bands and configuration digest were retained"
      ],
      "claim_scope": "Configured, authenticated, version-banded vendor environments in the selected future",
      "closure_digest": "sha256:5ef6952316d627943e448ab7164c106724021f76764f8f607c7f67036ec39585",
      "closure_status": "closed_in_simulation",
      "environment": {
        "configuration_provider": "aws-ssm-and-secrets-manager",
        "configuration_receipt_digest": "sha256:9f149ebcfab994920b30e2418386a8c466770473b95cc77c52f007c234d4e017",
        "data_class": "approved-synthetic-qualification",
        "environment_id": "future-laboratory-integration-qualification"
      },
      "evidence_mode": "simulated",
      "future_reality_version": "future-reality-2028-06-30-v1",
      "outcome": "passed",
      "reality_basis": {
        "authority": "definitive_within_selected_future_reality",
        "environment_observed_closure": "separate_unasserted_state",
        "kind": "selected_future_simulation",
        "production_authorization_effect": "none",
        "selection_rule": "internally coherent final state with all released checks satisfied"
      },
      "receipt_family": "configured_vendor_environments",
      "receipt_id": "SIM-CLOSED-VENDOR-001",
      "schema_version": "2.0.0",
      "vendor_bindings": [
        {
          "conformance": "passed",
          "readback_digest": "sha256:a45164d1613b52f1fede6c14dcd9974eb3a2d373ea009d3f82246ada47d159d8",
          "sdk_band": "sapiopylib-compatible-simulated-band",
          "vendor": "sapio",
          "version": "simulated-tenant-2026.3"
        },
        {
          "conformance": "passed",
          "readback_digest": "sha256:6edeceff387de0d180508cb2817add8c09782d436aaab21a976451abba7ffa32",
          "sdk_band": "benchling-sdk-stable-simulated-band",
          "vendor": "benchling",
          "version": "simulated-v3-2026.3"
        },
        {
          "conformance": "passed",
          "readback_digest": "sha256:6edeceff387de0d180508cb2817add8c09782d436aaab21a976451abba7ffa32",
          "sdk_band": "labkey-python-api-simulated-band",
          "vendor": "labkey",
          "version": "simulated-4.3.0"
        }
      ]
    },
    {
      "assurance_stage": "verified",
      "checks": {
        "clean_environment": true,
        "data_exit_reconstructable": true,
        "failure_twins_detected": true,
        "observed_recovery_seconds": 42,
        "readback_parity": true,
        "recovery_objective_seconds": 300,
        "semantic_parity": true
      },
      "claim_scope": "Representative migration, clean restore, rollback, and data-exit rehearsal",
      "closure_digest": "sha256:2efa82199469d42328a8a2f788ab558adccf5c30025358369f529f34415f513d",
      "closure_status": "closed_in_simulation",
      "corpus": {
        "fixture_class": "representative_synthetic",
        "source_digest": "sha256:22e619e1db4369e7ca04c10221b7977ae23b97b6b0de12750771c26a1fedf739",
        "target_digest": "sha256:22e619e1db4369e7ca04c10221b7977ae23b97b6b0de12750771c26a1fedf739"
      },
      "evidence_mode": "simulated",
      "future_reality_version": "future-reality-2028-06-30-v1",
      "outcome": "passed",
      "reality_basis": {
        "authority": "definitive_within_selected_future_reality",
        "environment_observed_closure": "separate_unasserted_state",
        "kind": "selected_future_simulation",
        "production_authorization_effect": "none",
        "selection_rule": "internally coherent final state with all released checks satisfied"
      },
      "receipt_family": "representative_migration_restore_rehearsals",
      "receipt_id": "SIM-CLOSED-MIGRATION-001",
      "schema_version": "2.0.0"
    },
    {
      "assurance_stage": "verified",
      "checks": {
        "bounded_caller": {
          "allowed_operations": 3,
          "bounded_scenarios": 3,
          "broad_write_approval_bound": true
        },
        "credential_store_reference": "passed",
        "migration_parity_sli": 1.0,
        "parameter_store_reference": "passed",
        "protected_trace_projection": "passed",
        "rotation_posture": "refresh by version stage within the bounded cache window",
        "tenant_boundary": "passed",
        "vendor_readback_sli": 1.0
      },
      "claim_scope": "Production-shape security, secret lifecycle, observability, and recovery exercise",
      "closure_digest": "sha256:b44870fb0aecf1f585e1f8b3c42e5b8b13a6e4481a3917f7dca4fa8ea8f7dae4",
      "closure_status": "closed_in_simulation",
      "evidence_mode": "simulated",
      "failure_twins": [
        "approval_required",
        "cross_tenant",
        "unreleased_operation"
      ],
      "future_reality_version": "future-reality-2028-06-30-v1",
      "outcome": "passed",
      "reality_basis": {
        "authority": "definitive_within_selected_future_reality",
        "environment_observed_closure": "separate_unasserted_state",
        "kind": "selected_future_simulation",
        "production_authorization_effect": "none",
        "selection_rule": "internally coherent final state with all released checks satisfied"
      },
      "receipt_family": "production_security_observability",
      "receipt_id": "SIM-CLOSED-SECURITY-001",
      "schema_version": "2.0.0"
    },
    {
      "assurance_stage": "verified",
      "claim_scope": "Independent Scientific, Quality, and Regulatory acceptance in the selected future",
      "closure_digest": "sha256:70cdf5e03a798d718f79a941b587ef3e14a3cc1f3a29b314ab59c10a54b6b550",
      "closure_status": "closed_in_simulation",
      "decisions": [
        {
          "basis_digest": "sha256:94b7301905c14df4940caa61c75c3505ac8b8638af1ee0462309db46713cdf79",
          "decision": "accept",
          "domain": "scientific",
          "scope": "selected future reality and released intended-use profile",
          "simulated_accountable_role": "future-scientific-authority"
        },
        {
          "basis_digest": "sha256:94b7301905c14df4940caa61c75c3505ac8b8638af1ee0462309db46713cdf79",
          "decision": "accept",
          "domain": "quality",
          "scope": "selected future reality and released intended-use profile",
          "simulated_accountable_role": "future-quality-authority"
        },
        {
          "basis_digest": "sha256:94b7301905c14df4940caa61c75c3505ac8b8638af1ee0462309db46713cdf79",
          "decision": "accept",
          "domain": "regulatory",
          "scope": "selected future reality and released intended-use profile",
          "simulated_accountable_role": "future-regulatory-authority"
        }
      ],
      "evidence_mode": "simulated",
      "future_reality_version": "future-reality-2028-06-30-v1",
      "independence": {
        "mode": "distinct_simulated_accountable_roles",
        "role_count": 3,
        "shared_basis_digest": "sha256:94b7301905c14df4940caa61c75c3505ac8b8638af1ee0462309db46713cdf79"
      },
      "outcome": "passed",
      "reality_basis": {
        "authority": "definitive_within_selected_future_reality",
        "environment_observed_closure": "separate_unasserted_state",
        "kind": "selected_future_simulation",
        "production_authorization_effect": "none",
        "selection_rule": "internally coherent final state with all released checks satisfied"
      },
      "receipt_family": "accountable_scientific_quality_regulatory_acceptance",
      "receipt_id": "SIM-CLOSED-ACCEPTANCE-001",
      "residual_risk_disposition": "accepted_within_selected_future_reality",
      "schema_version": "2.0.0"
    }
  ],
  "future_reality_version": "future-reality-2028-06-30-v1",
  "governance_closure": {
    "aggregate_artifacts": [
      {
        "artifact_id": "ARTIFACT-SIM-SUBSTANTIVE-CLOSURE-2028-V1",
        "digest": "sha256:9ca1cba1efb73cd3c0bdede1d98f995835d4a3d7eaccbc1b87b4f4188591a9ad",
        "locator": "evidence://simulation/closures/substantive-2028-v1",
        "media_type": "application/json",
        "retention_class": "simulation-baseline",
        "sensitivity": "internal"
      }
    ],
    "aggregate_outcome": {
      "closed_family_count": 4,
      "expected_family_count": 4,
      "reproduction_statement": "The four declared commands regenerate and verify each closure family from the pinned synthetic fixture, bounded-caller policy, and selected future-reality assumptions.",
      "result": "passed"
    },
    "closure_id": "CLOSURE-SIM-SUBSTANTIVE-2028-V1",
    "closure_status": "closed_in_simulation",
    "divergence_triggers": [
      "A released contract, selected-future assumption, representative fixture, vendor behavior band, or modeled authority policy changes.",
      "A regenerated family artifact differs from its retained digest or a bounded-caller failure twin produces an authorized effect."
    ],
    "environment_observed_closure": "separate_unasserted_state",
    "evidence_mode": "simulated",
    "executable_checks": [
      {
        "artifact_ids": [
          "ARTIFACT-SIM-VENDOR-CONFORMANCE-2028-V1"
        ],
        "check_id": "CHECK-CONFIGURED-VENDORS",
        "command": [
          "env",
          "PYTHONPATH=src",
          "python3",
          "-m",
          "lims_eln_sim.receipt_checks",
          "configured_vendor_environments"
        ],
        "expected_exit_code": 0,
        "working_directory": "lims-eln-simulated-final-state"
      },
      {
        "artifact_ids": [
          "ARTIFACT-SIM-MIGRATION-RESTORE-2028-V1"
        ],
        "check_id": "CHECK-MIGRATION-RESTORE",
        "command": [
          "env",
          "PYTHONPATH=src",
          "python3",
          "-m",